,Склад,Местоположение,"Код 
номенклатуры",Краткое наименование,Описание товара,ТГ,"Зарезерви
ровано",Доступно
1192,012_825,012_825-08-07-1,80090771,Банкетка 082,"Пуф Практик-7, коричневый",35,,2.0
1193,012_825,012_825-08-07-1,80287342,Кресло кожзам_226,"Кресло рабочее TOPMAX Charm 26066-DE, белый",39,,1.0
1194,012_825,012_825-08-07-1,80287344,Кресло кожзам_226,"Кресло рабочее TOPMAX Charm 26066-D, фиолетовый",39,,4.0
1195,012_825,012_825-08-07-1,80300394,Кресло кожзам_226,"Кресло рабочее TOPMAX Snipe 26623, белый (DM-157)",39,,1.0
1196,012_825,012_825-08-07-1,80306952,Кресло ткань_227,"Кресло рабочее DRESDEN CR-7029H, тёмно-серый/белый",39,,1.0
1197,012_825,012_825-08-07-1,80320927,Кресло ткань_226,"Кресло рабочее TOPMAX Charm 26066-D-F12, серый (A02-28)",39,,1.0
1198,012_825,012_825-08-07-1,80336455,Домашнее кресло ткань,"Кресло рабочее TOPMAX Kamarro 26673, серый (GZ040-32)",39,,12.0
1199,012_825,012_825-08-07-1,80420114,Банкетка_300,"Банкетка Классик, чёрный/белый (Punto)",38,,1.0
1200,012_825,012_825-08-07-2,80320926,Домашнее кресло ткань,"Кресло рабочее TOPMAX Derby 26662, синий (GZ040-16)",39,,1.0
1201,012_825,012_825-08-07-2,80343935,Пуф 082,"Пуф DreamBag Лугано Тип 1 13311, оранжевый",35,,1.0
1202,012_825,012_825-08-07-2,80343937,Пуф 082,"Пуф DreamBag Лугано Тип 1 13314, синий",35,,2.0
1203,012_825,012_825-08-07-2,80343939,Пуф 082,"Пуф DreamBag Лугано Тип 1 13316, бежевый",35,,3.0
1204,012_825,012_825-08-07-2,80344863,Кресло кожзам_227,"Кресло рабочее DUGLAS MLM-611506, тёмно-коричневый (012B)",39,,1.0
1205,012_825,012_825-08-07-2,80344866,Домашнее кресло ткань,"Кресло рабочее LOTOS MLM-660050, тёмно-синий (H1522-68)",39,,1.0
1206,012_825,012_825-08-07-2,80344870,Кресло ткань_227,"Кресло рабочее NORTON MLM-611499, чёрный (OHPU-001, MF-13)/тёмно-серый (OHPU-006)",39,,3.0
1207,012_825,012_825-08-07-2,80349571,Детское кресло,"Стул поворотный POLLY GTS, CM-02",39,,1.0
1208,012_825,012_825-08-07-2,80380919,Банкетка 082,"Пуф большой с ящиком для хранения DreamBag Garda 13540, коричневый",35,,2.0
1209,012_825,012_825-08-07-2,80380924,Банкетка 082,"Пуф большой DreamBag Garda 13533, серый",35,,1.0
1210,012_825,012_825-08-07-2,80380932,Пуф 082,"Пуф DreamBag Киото 13536, серый",35,,3.0
1211,012_825,012_825-08-07-2,80380934,Пуф 082,"Пуф DreamBag Лекко 13543, серый",35,,4.0
1212,012_825,012_825-08-07-2,80385732,стул ткань,"Стул Adele AV 417, изумрудный (Holland 30)/чёрный-глянец",40,,1.0
1213,012_825,012_825-08-07-2,80391494,Пуф 082,"Пуф DreamBag Лекко 13597, оникс",35,,3.0
1214,012_825,012_825-09-01-0,80336084,Кресло кожзам_227,"Кресло рабочее LAMBERT CYE379, коричневый (HP-0009)",39,,1.0
1215,012_825,012_825-09-01-0,80344856,Геймерское кресло 352,"Кресло рабочее SPENSER MLM-611529, чёрный (GPVC-001, K088)/тёмно-серый (GPVC-017)",39,,1.0
1216,012_825,012_825-09-01-0,80344862,Кресло ткань_227,"Кресло рабочее CHAPLIN MLM-611505, серый (H1522-56)",39,,1.0
1217,012_825,012_825-09-01-0,80435053,барный стул,"Стул полубарный Rock AV 415, коричневый (confetti koriza)/чёрный глянец",40,,3.0
1218,012_825,012_825-09-01-0,80435054,барный стул,"Стул полубарный Trast AV 435, серый (confetti blue stone)/чёрный глянец",40,,4.0
1219,012_825,012_825-09-01-0,80435055,барный стул,"Стул полубарный Trast AV 435, горчичный (confetti chai tea)/чёрный глянец",40,,2.0
1220,012_825,012_825-09-01-1,80297359,барный стул,"Барный стул ALTON MLM-620026, белый (60-4)/хром",40,,2.0
1221,012_825,012_825-09-01-1,80336819,Кресло ткань_227,"Кресло рабочее LAGGERT LA-8036FH-1, серый (T-03, JD-09)",39,,2.0
1222,012_825,012_825-09-01-1,80344854,Геймерское кресло 352,"Кресло рабочее RAVEN MLM-611370, чёрный (PU-06)/белый (PU-01)",39,,1.0
1223,012_825,012_825-09-01-1,80380924,Банкетка 082,"Пуф большой DreamBag Garda 13533, серый",35,,1.0
1224,012_825,012_825-09-01-1,80382574,Банкетка 191,"Банкетка Каскад, тёмно-серый (Velutto 32)",31,,1.0
1225,012_825,012_825-09-01-1,80385733,стул ткань,"Стул Adele AV 417, тёмно-серый (Holland 15)/чёрный-глянец",40,,2.0
1226,012_825,012_825-09-01-1,80424994,Домашнее кресло ткань,"Кресло офисное Люблин, коричневый (pеgaso chocolate)/коричневый (toronto 34)/хром",39,,1.0
1227,012_825,012_825-09-01-1,80424996,Домашнее кресло ткань,"Кресло офисное Лиссабон, зелёный (Confetti deep forest)/хром",39,,1.0
1228,012_825,012_825-09-01-2,80288324,стул кожзам,"Стул Рига С36, светло-молочный (меркури милк)/венге",40,,1.0
1229,012_825,012_825-09-01-2,80306085,стул ткань,"Стул Таллин С36Б, лавандовый (элва лаванда)/белая эмаль",40,,1.0
1230,012_825,012_825-09-01-2,80306086,стул ткань,"Стул Таллин С36Б, бежево-коричневый (грег 160/2)/венге",40,,1.0
1231,012_825,012_825-09-01-2,80360356,стул ткань,"Стул Martin AV 412, бежевый (Espo 12)/чёрный глянец",40,,1.0
1232,012_825,012_825-09-01-2,80377377,стул ткань,"Стул Ostin AV 408, коричневый (Holland H71)/чёрный глянец",40,,4.0
1233,012_825,012_825-09-01-2,80385732,стул ткань,"Стул Adele AV 417, изумрудный (Holland 30)/чёрный-глянец",40,,1.0
1234,012_825,012_825-09-01-2,80389871,стул кожзам,"Стул Leni AV 411, шоколадный матовый (221/1)/бежевый глянец (RAL 1015)",40,,2.0
1235,012_825,012_825-09-01-2,80422180,барный стул,"Барный стул Avalon AV 405, коричневый (Jaguar 23)/чёрный глянец",40,,2.0
1236,012_825,012_825-09-02-0,80338759,складной стул_233,"Стул WOODY II FC003, коричневый",40,,25.0
1237,012_825,012_825-09-02-0,80411982,Стул с ручками 222,"Стул SCONTO 0913-C, чёрный (JR1110)/тёмно-серый меланж (MST2021-3)",30,,2.0
1238,012_825,012_825-09-02-1,80019862,Кресло ткань_226,"Кресло Престиж/Самба, чёрный (С-11)",39,,1.0
1239,012_825,012_825-09-02-1,80272655,стул кожзам,"Стул Бистро, бежевый (Z-21)/хром",40,,2.0
1240,012_825,012_825-09-02-1,80301934,Геймерское кресло 352,"Кресло рабочее PAST MLM-611341, чёрный (60-1)/салатовый (220)/серый (221)",39,,1.0
1241,012_825,012_825-09-02-1,80324338,стул кожзам,"Стул Бистро Box, тёмно-коричневый (Z 10)/хром",40,,2.0
1242,012_825,012_825-09-02-1,80383375,Кресло ткань_226,"Кресло Эрго, чёрный (С-11)",39,,1.0
1243,012_825,012_825-09-02-1,80403536,стул кожзам,"Стул Ванесса, белый (Z01)/хром (CH)",40,,4.0
1244,012_825,012_825-09-02-1,80403537,стул кожзам,"Стул Ванесса, бежевый (Z21)/хром (CH)",40,,2.0
1245,012_825,012_825-09-02-1,80403539,стул кожзам,"Стул Нерон, белый (Z01)/хром (CH)",40,,2.0
1246,012_825,012_825-09-02-1,80424991,Домашнее кресло ткань,"Кресло офисное Майами, чёрный (Velutto 34)/хром",39,,1.0
1247,012_825,012_825-09-02-2,80259730,Кресло кожзам_227,"Кресло Идра Бюджет, чёрный (Эк-01)",39,,5.0
1248,012_825,012_825-09-02-2,80343760,стул ткань,"Стул FINCH TC-1963, серый (COMO-09)/чёрный матовый",40,,7.0
1249,012_825,012_825-09-03-0,80019862,Кресло ткань_226,"Кресло Престиж/Самба, чёрный (С-11)",39,,4.0
1250,012_825,012_825-09-03-0,80269912,Кресло ткань_226,"Кресло поворотное BETTA GTP, чёрный (C-11/OH 5)",39,,2.0
1251,012_825,012_825-09-03-0,80273550,стул кожзам,"Стул TOLEDO TC-1002DS, чёрный",40,,2.0
1252,012_825,012_825-09-03-0,80287344,Кресло кожзам_226,"Кресло рабочее TOPMAX Charm 26066-D, фиолетовый",39,,1.0
1253,012_825,012_825-09-03-0,80301260,Геймерское кресло 352,"Кресло рабочее PRESENT FY-2312, чёрный/белый",39,,1.0
1254,012_825,012_825-09-03-0,80306448,Кресло кожзам_227,"Кресло рабочее LANCASTER MLM-611347, чёрный (60-1)",39,,1.0
1255,012_825,012_825-09-03-0,80336085,Кресло кожзам_227,"Кресло рабочее LAMBERT CYE379, бежевый (FP-0100)",39,,1.0
1256,012_825,012_825-09-03-0,80336454,Домашнее кресло ткань,"Кресло рабочее TOPMAX Tennesy 26664C, бежевый (607)",39,,1.0
1257,012_825,012_825-09-03-0,80385733,стул ткань,"Стул Adele AV 417, тёмно-серый (Holland 15)/чёрный-глянец",40,,2.0
1258,012_825,012_825-09-03-1,80324338,стул кожзам,"Стул Бистро Box, тёмно-коричневый (Z 10)/хром",40,,2.0
1259,012_825,012_825-09-03-1,80371379,Кресло ткань_226,"Стул поворотный STARK GTP, серый (С-73)/серебристый (ОН 1) (TILT PL 64)",39,,1.0
1260,012_825,012_825-09-03-1,80403536,стул кожзам,"Стул Ванесса, белый (Z01)/хром (CH)",40,,6.0
1261,012_825,012_825-09-03-1,80403538,стул кожзам,"Стул Ванесса, тёмно-коричневый (Z10)/хром (CH)",40,,6.0
1262,012_825,012_825-09-03-2,80259730,Кресло кожзам_227,"Кресло Идра Бюджет, чёрный (Эк-01)",39,,1.0
1263,012_825,012_825-09-03-2,80285729,Кресло кожзам_227,"Кресло Идра Бюджет, белый (TR-100)",39,,2.0
1264,012_825,012_825-09-03-2,80298432,Кресло кожзам_227,"Кресло СН400NEW, чёрный (Эк-01/1)",39,,3.0
1265,012_825,012_825-09-03-2,80306918,стул ткань,"Стул Артис, серый (Silkshine 76)/венге",40,,2.0
1266,012_825,012_825-09-03-2,80389870,стул кожзам,"Стул Leni AV 411, белый (201)/бежевый глянец (RAL 1015)",40,,1.0
1267,012_825,012_825-09-04-0,80335750,стул дерево 090,"Стул Модерн Самурай, орех",40,,1.0
1268,012_825,012_825-09-04-0,80389870,стул кожзам,"Стул Leni AV 411, белый (201)/бежевый глянец (RAL 1015)",40,,2.0
1269,012_825,012_825-09-04-0,80403539,стул кожзам,"Стул Нерон, белый (Z01)/хром (CH)",40,,6.0
1270,012_825,012_825-09-04-0,80403540,стул кожзам,"Стул Нерон, бежевый (Z21)/хром (CH)",40,,6.0
1271,012_825,012_825-09-04-1,80297344,Кресло кожзам_226,"Кресло рабочее LUXE MLM-611276, чёрный (60-1, MF-12)",39,,6.0
1272,012_825,012_825-09-04-1,80336511,Кресло ткань_226,"Стул поворотный PRESTIGE GTS (J), чёрный (ZT-25)/Енот (TA 1)",39,,1.0
1273,012_825,012_825-09-04-1,80349572,Кресло ткань_226,"Кресло поворотное BETTA GTP, серый (C-73/OH 14)",39,,1.0
1274,012_825,012_825-09-04-1,80360358,стул ткань,"Стул Ostin AV 408, тёмно-серый (Holland H15)/чёрный глянец",40,,4.0
1275,012_825,012_825-09-04-1,80397353,стул кожзам,"Стул Lina СРП-009, коричневый (экотекс 3029)/зеркальный хром",40,,1.0
1276,012_825,012_825-09-04-1,80403537,стул кожзам,"Стул Ванесса, бежевый (Z21)/хром (CH)",40,,6.0
1277,012_825,012_825-09-04-1,80432314,Банкетка 191,"Банкетка Венеция, розовый (Talisman 11)",31,,1.0
1278,012_825,012_825-09-04-2,80259729,Кресло кожзам_227,"Кресло Идра Бюджет, коричневый (TR-221)",39,,6.0
1279,012_825,012_825-09-04-2,80269463,Детское кресло,"Кресло Эрго, коричневый, карта",39,,6.0
1280,012_825,012_825-09-04-2,80383375,Кресло ткань_226,"Кресло Эрго, чёрный (С-11)",39,,6.0
1281,012_825,012_825-09-04-2,80422181,барный стул,"Барный стул Avalon AV 405, серый (Jaguar 09)/чёрный глянец",40,,1.0
1282,012_825,012_825-09-05-0,80272655,стул кожзам,"Стул Бистро, бежевый (Z-21)/хром",40,,8.0
1283,012_825,012_825-09-05-0,80302078,Тумба 191,"Тумба прикроватная с двумя ящиками Коста 2, серый (Talisman 13)",31,,1.0
1284,012_825,012_825-09-05-0,80306774,Тумба 191,"Тумба прикроватная с тремя ящиками Твист, серый (Galaxy asphalt)",31,,1.0
1285,012_825,012_825-09-05-0,80338758,складной стул_233,"Стул WOODY II FC003, светло-коричневый",40,,7.0
1286,012_825,012_825-09-05-0,80344858,Геймерское кресло 352,"Кресло рабочее RODGER MLM-611473, чёрный (GPVC-001), синий (GPVC-008)/тёмно-серый (MF-13)",39,,2.0
1287,012_825,012_825-09-05-0,80411819,Тумба 191,"Тумба прикроватная с тремя ящиками Твист, серо-сиреневый (Velutto 10)",31,,1.0
1288,012_825,012_825-09-05-1,80288320,стул ткань,"Стул Дакар С40А, светло-бежевый (брикс ивори)/венге",40,,1.0
1289,012_825,012_825-09-05-1,80293326,табурет металл,"Табурет ТП01, чёрный",40,,1.0
1290,012_825,012_825-09-05-1,80311574,стул ткань,"Стул Алинда Т1 F-211.00, бежевый (249)/слоновая кость",40,,4.0
1291,012_825,012_825-09-05-1,80317397,Кресло кожзам_227,"Кресло рабочее DARVIN MLM-611382, серый (45)",39,,1.0
1292,012_825,012_825-09-05-1,80338758,складной стул_233,"Стул WOODY II FC003, светло-коричневый",40,,2.0
1293,012_825,012_825-09-05-1,80377376,стул ткань,"Стул Ostin AV 408, светло-бежевый (Holland H06)/чёрный глянец",40,,2.0
1294,012_825,012_825-09-05-1,80387438,стул ткань,"Стул Лима 2 Б-520, коричневый (177)/венге",40,,1.0
1295,012_825,012_825-09-05-1,80403541,стул кожзам,"Стул Нерон, тёмно-коричневый (Z10)/хром (CH)",40,,5.0
1296,012_825,012_825-09-05-1,80413859,стул ткань,"Стул Seattle AV 424, сиреневый (Holland H36)/чёрный глянец",40,,2.0
1297,012_825,012_825-09-05-2,80019862,Кресло ткань_226,"Кресло Престиж/Самба, чёрный (С-11)",39,,14.0
1298,012_825,012_825-09-05-2,80260032,Кресло ткань_226,"Кресло Престиж/Самба, серый (С-73)",39,,14.0
1299,012_825,012_825-09-05-2,80435058,барный стул,"Барный стул Martin AV 412, тёмно-серый (Espo 83)/чёрный глянец",40,,2.0
1300,012_825,012_825-09-06-0,80266213,стул кожзам,"Стул Эвелина-2 ВС/181, белый (527)/тёмный венге",40,,4.0
1301,012_825,012_825-09-06-0,80291181,стул кожзам,"Стул TOPMAX Kokong 80025-PU, бук/белый (137)",40,,5.0
1302,012_825,012_825-09-06-0,80422180,барный стул,"Барный стул Avalon AV 405, коричневый (Jaguar 23)/чёрный глянец",40,,2.0
1303,012_825,012_825-09-06-1,80281110,Банкетка_300_металл,"Тумба ТП-5, венге (1)/серый",38,,1.0
1304,012_825,012_825-09-06-1,80284509,Сервировочный стол,"Сервировочный стол ANYDAY PHILLIP SSPL-1, темный бук",35,,3.0
1305,012_825,012_825-09-06-1,80286145,табурет дерево,"Табурет Премьера НМ.64.19.00, пикард/черный фон",40,,7.0
1306,012_825,012_825-09-06-1,80286648,стул кожзам,"Стул Бистро, белый (Z-01)/хром",40,,4.0
1307,012_825,012_825-09-06-1,80300335,Банкетка_300_металл,"Тумба ТП-5, дуб Сонома/серый",38,,1.0
1308,012_825,012_825-09-06-1,80312250,стул кожзам,"Стул Milton СРП-007, белый (ТНВ-1)/зеркальный хром",40,,4.0
1309,012_825,012_825-09-06-1,80325141,табурет дерево,"Банкетка Прайм, бежевый (Бинго светлый)/дуб Сонома трюфель",40,,4.0
1310,012_825,012_825-09-06-1,80332877,барный стул,"Барный стул TOPMAX Alert 80018-D2-BA-F11, светло-серый (A02-7)/чёрный",40,,1.0
1311,012_825,012_825-09-06-1,80382573,Банкетка 191,"Банкетка Каскад, светло-бежевый (Velutto 17)",31,,1.0
1312,012_825,012_825-09-06-2,80259728,Кресло кожзам_227,"Кресло Идра Бюджет, бежевый (Эк-06)",39,,6.0
1313,012_825,012_825-09-06-2,80286648,стул кожзам,"Стул Бистро, белый (Z-01)/хром",40,,2.0
1314,012_825,012_825-09-06-2,80360358,стул ткань,"Стул Ostin AV 408, тёмно-серый (Holland H15)/чёрный глянец",40,,1.0
1315,012_825,012_825-09-06-2,80435058,барный стул,"Барный стул Martin AV 412, тёмно-серый (Espo 83)/чёрный глянец",40,,2.0
1316,012_825,012_825-09-07-0,80283497,Сундуки без принта,"Сундук ""Золотой песок"" FRA-09L, бежевый",27,,1.0
1317,012_825,012_825-09-07-0,80291505,Сундуки без принта,"Сундук ""Лунный свет"" FRA-14, серый",27,,2.0
1318,012_825,012_825-09-07-0,80291506,Сундуки без принта,"Сундук ""Антрацит"" FRA-15, тёмно-серый",27,,1.0
1319,012_825,012_825-09-07-0,80322609,Сундуки без принта,"Сундук ""Аллигатор"" FRA-30, коричневый",27,,1.0
1320,012_825,012_825-09-07-0,80322610,Сундуки без принта,"Сундук ""Аллигатор"" FRA-31, чёрный",27,,1.0
1321,012_825,012_825-09-07-0,80409183,Сундуки с принтом,Сундук Геометрия 119T015-1,27,,1.0
1322,012_825,012_825-09-07-0,80428197,Сундуки без принта,"Сундук Прованс FRA-54, 60х39х36 см, бежевый/розовый",27,,1.0
1323,012_825,012_825-09-07-0,80428198,Сундуки без принта,"Сундук с пуговицами Пепельный FRA-61, 70х40х40 см, серый",27,,1.0
1324,012_825,012_825-09-07-0,80428199,Сундуки без принта,"Сундук с пуговицами Кофейный FRA-62, 70х40х40 см, коричневый",27,,1.0
1325,012_825,012_825-10-01-0,80297257,"Пледы 1,5 спальные","Плед MICASA Lanado FEMB, 140х200 см, бежевый",11,,16.0
1326,012_825,012_825-10-01-0,80297260,Пледы 2 спальные,"Плед MICASA Lanado FEMB, 200х220 см, бежевый",11,,12.0
1327,012_825,012_825-10-01-0,80330979,"Пледы 1,5 спальные","Плед IMPRESS Grassy 17HF029, 150х200 см, тёмно-зелёный",11,,20.0
1328,012_825,012_825-10-01-0,80330981,"Пледы 1,5 спальные","Плед MICASA Cotufa 17FH001, 140х200 см, фиолетовый",11,,17.0
1329,012_825,012_825-10-01-0,80366169,КПБ семейные,"КПБ Дуэт ESTUDI BLANCO Darsia 382-1/0032952/2043, (нав. 50(70)х70 см-2 шт.), белый",11,,1.0
1330,012_825,012_825-10-01-0,80371978,Наволочки 50х70,"Комплект наволочек IMPRESS 66531, 50х70 см, 2 шт., в асс.",11,,7.0
1331,012_825,012_825-10-01-0,80416561,Наматрасники 90(100)х200,"Наматрасник MICASA Бамбук 56м-6-90, 90х200 см",11,,10.0
1332,012_825,012_825-10-01-0,80416562,Наматрасники 140х200,"Наматрасник MICASA Бамбук 56м-6-140, 140х200 см",11,,10.0
1333,012_825,012_825-10-01-0,80416563,Наматрасники 160х200,"Наматрасник MICASA Бамбук 56м-6-160, 160х200 см",11,,10.0
1334,012_825,012_825-10-01-0,80416564,Наматрасники 180(200)х200,"Наматрасник MICASA Бамбук 56м-6-180, 180х200 см",11,,10.0
1335,012_825,012_825-10-01-0,80416565,Наматрасники 200х200,"Наматрасник MICASA Бамбук 56м-6-200, 200х200 см",11,,3.0
1336,012_825,012_825-10-01-0,80427024,КПБ семейные,"КПБ Дуэт ESTUDI BLANCO Erminia 370/0031667*/3034 (нав. 50(70)х70 см - 2 шт.), бежевый",11,,1.0
1337,012_825,012_825-10-01-0,80440386,КПБ 2 спальные,"КПБ 2 сп. ESTUDI BLANCO Rafaella 670/0031667*/3032 (нав. 50(70)х70 см - 2 шт.), молочный/белый",11,,6.0
1338,012_825,012_825-10-01-1,80295146,Наматрасники 180(200)х200,"Наматрасник с резинками MITTE 4600, 180х200 см",11,,10.0
1339,012_825,012_825-10-01-1,80299238,Полотенца банные,"Полотенце банное MITTE Sommer, 70х140 см, светло-жёлтый",11,,15.0
1340,012_825,012_825-10-01-1,80324158,Полотенца для рук,"Полотенце махровое IMPRESS York 6130413, 50х90 см, фиолетовый",11,,8.0
1341,012_825,012_825-10-01-1,80324159,Полотенца банные,"Полотенце махровое IMPRESS York 6130414, 70х140 см, белый",11,,1.0
1342,012_825,012_825-10-01-1,80333239,наборы кухонных полотенец,"Комплект полотенец ЛЁН наш Кухни Мира 187643, 50х70 см, 7 шт.",22,,4.0
1343,012_825,012_825-10-01-1,80333243,кухонные полотенца,"Полотенце ЛЁН наш 198122, 50х60 см, в асс.",22,,7.0
1344,012_825,012_825-10-01-1,80347193,Полотенца банные,"Полотенце ESTUDI BLANCO Alpero, 70х140 см, кремовый",11,,20.0
1345,012_825,012_825-10-01-1,80371961,Простыни натяж. 90х200,"Простыня на резинке IMPRESS 66514, 90х200 см, светло-голубой",11,,3.0
1346,012_825,012_825-10-01-1,80381438,наборы кухонных полотенец,"Комплект полотенец MITTE Art Déco Геометрия 217807, 47х61 см, 2 шт., синий/белый",22,,5.0
1347,012_825,012_825-10-01-1,80405775,Полотенца для рук,"Полотенце махровое MICASA Rombo, 50x90 см, белый",11,,10.0
1348,012_825,012_825-10-01-1,80405776,Полотенца банные,"Полотенце махровое MICASA Rombo, 70x140 см, белый",11,,7.0
1349,012_825,012_825-10-01-1,80405780,Полотенца для рук,"Полотенце махровое MICASA Rombo, 50x90 см, светло-бежевый",11,,8.0
1350,012_825,012_825-10-01-1,80405781,Полотенца банные,"Полотенце махровое MICASA Rombo, 70x140 см, светло-бежевый",11,,7.0
1351,012_825,012_825-10-01-1,80405785,Полотенца для рук,"Полотенце махровое MICASA Rombo, 50x90 см, светло-коричневый",11,,10.0
1352,012_825,012_825-10-01-1,80405786,Полотенца банные,"Полотенце махровое MICASA Rombo, 70x140 см, светло-коричневый",11,,1.0
1353,012_825,012_825-10-01-1,80405791,Полотенца банные,"Полотенце махровое MICASA Rombo, 70x140 см, коричневый",11,,15.0
1354,012_825,012_825-10-01-1,80405795,Полотенца для рук,"Полотенце махровое MICASA Rombo, 50x90 см, тёмно-оливковый",11,,10.0
1355,012_825,012_825-10-01-1,80416973,Полотенца для рук,"Полотенце махровое MITTE Quadrat 6151317, 50х90 см, кремовый (002)",11,,35.0
1356,012_825,012_825-10-01-1,80416974,Полотенца для рук,"Полотенце махровое MITTE Quadrat 6151318, 50х90 см, жёлтый (024)",11,,20.0
1357,012_825,012_825-10-01-1,80416986,Полотенца банные,"Полотенце махровое MITTE Quadrat 6151330, 70х130 см, светло-розовый (051)",11,,15.0
1358,012_825,012_825-10-01-1,80416987,Полотенца банные,"Полотенце махровое MITTE Quadrat 6151331, 70х130 см, тёмно-розовый (059)",11,,24.0
1359,012_825,012_825-10-01-1,80416988,Полотенца банные,"Полотенце махровое MITTE Quadrat 6151332, 70х130 см, светло-серый (091)",11,,25.0
1360,012_825,012_825-10-01-1,80416992,Полотенца банные,"Полотенце махровое MITTE Quadrat 6151336, 70х130 см, зелёный (061)",11,,26.0
